{
    "$schema": "http://json-schema.org/draft-07/schema#",
    "$id": "urn:plasmazones:schema:animation-metadata",
    "title": "PlasmaZones Animation Shader Metadata",
    "description": "metadata.json for a bundled or user animation-shader pack. Core identity and the parameter contract are enforced. The optional rendering keys (vertexShader, fboExtent, textures, appliesTo, geometryGrid, preview), the audio and multipass keys (audio, multipass, bufferShaders, bufferScale, bufferWrap, bufferWraps, bufferFilter, bufferFilters, bufferFeedback, depthBuffer, wallpaper), the named parameter presets and the descriptive metadata (description, author, version, category) are type-checked, so a wrong-typed value is rejected at the gate rather than swallowed by a typed accessor at load. Unknown top-level keys are still accepted rather than rejected, so this schema will not catch a mis-spelled key such as \"preset\" for \"presets\". The loader ignores anything it does not know. There is no per-pass bufferScales list here. That is surface-only, and one bufferScale covers the whole chain.",
    "type": "object",
    "required": ["id", "name", "fragmentShader", "parameters"],
    "properties": {
        "id": { "type": "string", "minLength": 1 },
        "name": { "type": "string", "minLength": 1 },
        "description": { "type": "string" },
        "author": { "type": "string" },
        "version": { "type": "string" },
        "category": { "type": "string" },
        "fragmentShader": { "type": "string", "minLength": 1 },
        "vertexShader": { "type": "string" },
        "preview": { "type": "string" },
        "fboExtent": {
            "type": "string",
            "enum": ["anchor", "surface"],
            "description": "Which rect the effect's FBO spans. \"anchor\" is the captured window, and is what an absent key means. \"surface\" is the whole surface, which a pack needs when it draws outside the window's own bounds. The loader matches these case-insensitively and warns on anything else, so the enum here is the strict spelling rather than the accepted one."
        },
        "textures": {
            "type": "array",
            "maxItems": 3,
            "items": {
                "type": "object",
                "required": ["path"],
                "additionalProperties": false,
                "properties": {
                    "path": { "type": "string", "minLength": 1 },
                    "wrap": { "type": "string", "enum": ["clamp", "repeat", "mirror"] }
                }
            },
            "description": "Image textures the pack declares. Slot N feeds uTexture<N+1>, because uTexture0 is the window's own content, and that slot's pixel size arrives at iTextureResolution[N+1]. Paths are pack-relative and are containment-checked at load."
        },
        "appliesTo": {
            "type": "array",
            "items": { "type": "string", "enum": ["geometry", "appearance", "desktop", "move", "strip", "tab"] },
            "description": "Event classes this pack offers itself for. An absent key, or one that validates down to empty, means universal, which is everywhere except the four opt-in classes desktop, move, strip and tab. The loader drops an unknown token with a warning rather than failing the pack, so this enum is what catches the typo at the gate."
        },
        "geometryGrid": {
            "type": "integer",
            "minimum": 1,
            "description": "Vertex-grid subdivisions, for a pack whose vertex stage displaces geometry. Absent or zero means the pack is drawn on a plain quad."
        },
        "audio": {
            "type": "boolean",
            "description": "The pack samples the CAVA spectrum through data/animations/shared/audio.glsl. This flag is what keys the compositor's CAVA run-gate. The daemon reads it nowhere, including in its own run-gate, so an audio animation pack hosted by the daemon can be fed a spectrum that was never started."
        },
        "multipass": { "type": "boolean" },
        "bufferShaders": {
            "type": "array",
            "items": { "type": "string" },
            "maxItems": 8
        },
        "bufferScale": {
            "type": "number",
            "minimum": 0.0078125,
            "maximum": 1.0,
            "description": "Render scale for the WHOLE buffer chain. Bounds track PhosphorShaders::kMinBufferScale and kMaxBufferScale."
        },
        "bufferWrap": { "type": "string", "enum": ["clamp", "repeat", "mirror"] },
        "bufferWraps": {
            "type": "array",
            "items": { "type": "string", "enum": ["clamp", "repeat", "mirror"] },
            "maxItems": 8
        },
        "bufferFilter": { "type": "string", "enum": ["linear", "nearest", "mipmap"] },
        "bufferFilters": {
            "type": "array",
            "items": { "type": "string", "enum": ["linear", "nearest", "mipmap"] },
            "maxItems": 8
        },
        "bufferFeedback": { "type": "boolean" },
        "depthBuffer": { "type": "boolean" },
        "wallpaper": { "type": "boolean" },
        "presets": {
            "type": "object",
            "maxProperties": 64,
            "description": "Named parameter presets. Each value is a map of parameter id to value, naming a subset of the pack's declared parameters. A preset id is its key here, and it is also the label the picker shows, so it has to read as a name. That rules out control and bidi-formatting characters, and anything longer than a label can show. Unlike a user preset id it never becomes a filename, because duplicating a pack preset mints a fresh UUID. A null value is allowed and means the preset says nothing about that parameter, so it keeps the pack's default, and the loader drops the entry. Those rules are checked by plasmazones-shader-validate rather than here, because the vendored JSON-schema validator rejects every name under a propertyNames rule, legitimate ones included.",
            "additionalProperties": {
                "type": "object",
                "maxProperties": 48,
                "additionalProperties": { "type": ["number", "string", "boolean", "null"] }
            }
        },
        "parameters": {
            "type": "array",
            "maxItems": 48,
            "items": { "$ref": "#/definitions/parameter" }
        }
    },
    "definitions": {
        "parameter": {
            "type": "object",
            "required": ["id", "name", "type", "default"],
            "properties": {
                "id": { "type": "string", "minLength": 1 },
                "name": { "type": "string", "minLength": 1 },
                "description": { "type": "string" },
                "type": {
                    "type": "string",
                    "enum": ["float", "int", "bool", "color"],
                    "description": "Marshalling type of the uniform. An unknown type cannot be bound, so it is rejected."
                },
                "default": {
                    "type": ["number", "string", "boolean"],
                    "description": "Default value. Use a string for color (#rrggbb), a number for float or int, and a boolean for bool."
                },
                "min": { "type": "number" },
                "max": { "type": "number" }
            }
        }
    }
}
