{
    "id": "window-morph",
    "name": "Window Morph",
    "description": "Geometry move and resize transition. The window jumps to its destination instantly, and this shader animates the drawn rect from the old geometry to the new one. The content is drawn at its final size the whole way, so a snap, tile or reflow slides and crops into place with the window's pixels staying exactly as sharp as they are when it settles.",
    "author": "PlasmaZones",
    "version": "1.0",
    "category": "Geometry",
    "appliesTo": ["geometry"],
    "fragmentShader": "effect.frag",
    "vertexShader": "effect.vert",
    "fboExtent": "surface",
    "parameters": []
}
